{
 "schema_version": "1.0",
 "citekey": "2018jiang",
 "doi": "10.1109/tnsre.2018.2821194",
 "model_system": [
  "ex_vivo_tissue"
 ],
 "species": "rat (Sprague-Dawley)",
 "conditions": [
  "healthy"
 ],
 "condition_other": null,
 "n_subjects": 7,
 "subject_unit": "preparation",
 "n_sessions_per_subject": null,
 "randomised": null,
 "blinding": null,
 "sham_type": [
  "none"
 ],
 "auditory_control": [
  "not_reported"
 ],
 "readouts": [
  "invasive_electrophysiology"
 ],
 "readout_other": "120-electrode multielectrode array recordings of retinal ganglion cell spiking",
 "readout_timing": "online",
 "anaesthesia": null,
 "direction_of_effect": "excitatory",
 "direction_notes": "US reliably activated RGCs (98.28% of channels responded); with increasing intensity latency shortened, firing rate rose and response type shifted (e.g. ON-transient cells began to respond at both onset and offset).",
 "adverse_events": null,
 "safety_notes": null,
 "exposures": [
  {
   "label": "2.25 MHz focused US on isolated rat retina",
   "target": {
    "terms": [
     "retinal_explant",
     "retina"
    ],
    "label": "rat retinal ganglion cells (RGCs)"
   },
   "device": {
    "family": "other_manufacturer",
    "manufacturer": "Valpey Fisher Corporation",
    "model": "IL0206HP"
   },
   "fundamental_frequency_khz": 2250,
   "free_field": {
    "pressure_kpa": 331,
    "isppa_w_cm2": "not_reported",
    "ispta_w_cm2": [
     0.28,
     13.16
    ]
   },
   "in_situ": {
    "method": null,
    "reported_as": null,
    "pressure_kpa": null,
    "isppa_w_cm2": null,
    "ispta_w_cm2": null
   },
   "unspecified_domain": {
    "pressure_kpa": null,
    "isppa_w_cm2": null,
    "ispta_w_cm2": null
   },
   "timing": {
    "waveform": "pulsed",
    "pulse_duration_ms": 0.5,
    "pulse_repetition_frequency_hz": 1000,
    "duty_cycle_pct": "not_reported",
    "sonication_duration_s": 0.4,
    "protocol_description": "Pulsed mode: PRF 1 kHz, tone burst duration 0.5 ms, sonication duration 400 ms, interstimulus interval 2 s; 15 stimulus trains per experiment with a 3 min pause between experiments. Intensity varied by function generator voltage."
   },
   "derived": {
    "checks": [],
    "not_reported": [
     "free_field.isppa_w_cm2",
     "timing.duty_cycle_pct"
    ],
    "field_status": {
     "fundamental_frequency_khz": {
      "quote_verified": true,
      "second_pass": "agree",
      "tiebreak": null,
      "flagged": false
     },
     "free_field.pressure_kpa": {
      "quote_verified": true,
      "second_pass": "agree",
      "tiebreak": null,
      "flagged": true
     },
     "free_field.ispta_w_cm2": {
      "quote_verified": true,
      "second_pass": "agree",
      "tiebreak": "neither",
      "flagged": false
     },
     "timing.pulse_duration_ms": {
      "quote_verified": true,
      "second_pass": "agree",
      "tiebreak": null,
      "flagged": false
     },
     "timing.pulse_repetition_frequency_hz": {
      "quote_verified": true,
      "second_pass": "agree",
      "tiebreak": null,
      "flagged": false
     },
     "timing.sonication_duration_s": {
      "quote_verified": true,
      "second_pass": "agree",
      "tiebreak": null,
      "flagged": false
     },
     "device.manufacturer": {
      "quote_verified": true,
      "second_pass": null,
      "tiebreak": null,
      "flagged": false
     },
     "device.model": {
      "quote_verified": true,
      "second_pass": null,
      "tiebreak": null,
      "flagged": false
     }
    },
    "duty_cycle_computed_pct": 50.0
   }
  }
 ],
 "provenance": {
  "extracted": {
   "by": "paper-extractor",
   "model": "claude-sonnet-5-5",
   "date": "2026-10-27"
  },
  "source_quotes": {
   "exposures[0].fundamental_frequency_khz": "A 2.25 MHz focused US transducer was used in this study.",
   "exposures[0].timing.pulse_repetition_frequency_hz": "the ultrasound parameters were set as follows: pulse repetition frequency of 1 kHz, tone burst duration of 0.5 ms, sonication duration of 400 ms, and interstimulus interval of 2 s.",
   "exposures[0].timing.pulse_duration_ms": "the ultrasound parameters were set as follows: pulse repetition frequency of 1 kHz, tone burst duration of 0.5 ms, sonication duration of 400 ms, and interstimulus interval of 2 s.",
   "exposures[0].timing.sonication_duration_s": "the ultrasound parameters were set as follows: pulse repetition frequency of 1 kHz, tone burst duration of 0.5 ms, sonication duration of 400 ms, and interstimulus interval of 2 s.",
   "n_subjects": "In total, 116 RGC recording channels from 7 retinas were analyzed.",
   "exposures[0].free_field.pressure_kpa": "The scan shows that the peak acoustic pressure was 331 kPa, which was regarded as an intensity of 0 dB.",
   "exposures[0].device.model": "used to drive a US transducer (IL0206HP, Valpey Fisher Corporation, Hopkinton, MA, USA)",
   "exposures[0].device.manufacturer": "used to drive a US transducer (IL0206HP, Valpey Fisher Corporation, Hopkinton, MA, USA)",
   "exposures[0].free_field.ispta_w_cm2": "It was calculated from the measured acoustic pressures and the set sonication parameters using equations described in the literature [28]."
  },
  "flags": [
   {
    "field": "exposures[0].unspecified_domain.ispta_w_cm2",
    "reason": "Intensity was varied; the paper gives individual values (threshold 0.28 W/cm2, 12.84 W/cm2 in Fig 5, saturation around 12.84 to 13.16 W/cm2), not a stated sweep range. Two-element list is the threshold and the upper value; quote carries only the upper value. Ispta was calculated from pressure and scaled by 46.34% for the filter membrane."
   },
   {
    "field": "exposures[0].free_field.pressure_kpa",
    "reason": "Peak pressure 331 kPa is from a hydrophone scan in a water tank, not explicitly tied to the stimulation settings; the filter membrane attenuated peak pressure (38 vs 82 kPa)."
   },
   {
    "field": "exposures[0].timing.duty_cycle_pct",
    "reason": "Duty cycle not stated."
   },
   {
    "field": "exposures[0].device.family",
    "reason": "Valpey Fisher is a named maker not in the list; mapped to other_manufacturer."
   }
  ],
  "human_edited": false,
  "notes": null,
  "second_pass": {
   "n_subjects": "agree",
   "n_sessions_per_subject": "agree",
   "exposures[0].fundamental_frequency_khz": "agree",
   "exposures[0].free_field.pressure_kpa": "agree",
   "exposures[0].free_field.isppa_w_cm2": "agree",
   "exposures[0].free_field.ispta_w_cm2": "disagree",
   "exposures[0].in_situ.pressure_kpa": "agree",
   "exposures[0].in_situ.isppa_w_cm2": "agree",
   "exposures[0].in_situ.ispta_w_cm2": "agree",
   "exposures[0].unspecified_domain.pressure_kpa": "agree",
   "exposures[0].unspecified_domain.isppa_w_cm2": "agree",
   "exposures[0].unspecified_domain.ispta_w_cm2": "disagree",
   "exposures[0].timing.pulse_duration_ms": "agree",
   "exposures[0].timing.pulse_repetition_frequency_hz": "agree",
   "exposures[0].timing.duty_cycle_pct": "agree",
   "exposures[0].timing.sonication_duration_s": "agree"
  },
  "tiebreak": {
   "exposures[0].free_field.ispta_w_cm2": "neither",
   "exposures[0].unspecified_domain.ispta_w_cm2": "second"
  }
 }
}
